{
  "credit": "Made with Blockbench (converted from FirstDoctorTardisModel.java)",
  "texture_width": 96,
  "texture_height": 96,
  "texture": "dwm:textures/entity/first_doctor_box.png",
  "parts": [
    {
      "name": "bone9",
      "pivot": [0.0, 11.9, -5.5],
      "rotation": [0.0, -45.000105, 0.0]
    },
    {
      "name": "bone10",
      "pivot": [0.0, -0.5, -6.3],
      "rotation": [-45.000105, 0.0, 0.0]
    },
    {
      "name": "bone11",
      "pivot": [0.0, -1.5, -6.3],
      "rotation": [-45.000105, 0.0, 0.0]
    },
    {
      "name": "bone12",
      "pivot": [-2.7, 6.9, -5.2],
      "rotation": [20.001957, 0.0, 0.0]
    },
    {
      "name": "bone13",
      "pivot": [-2.7, 6.4, -5.2],
      "rotation": [-45.000105, 0.0, 0.0]
    },
    {
      "name": "bone14",
      "pivot": [1.2, 4.6272, -5.1728],
      "rotation": [0.0, -45.000105, 0.0]
    },
    {
      "name": "post",
      "pivot": [-5.5, 23.0, -7.0],
      "cubes": [
        { "uv": [0, 0], "origin": [-1.5, -24.6, 0.5], "size": [1.0, 25.0, 1.0] },
        { "uv": [0, 0], "origin": [-0.5, -24.6, 0.5], "size": [1.0, 25.0, 1.0] },
        { "uv": [0, 0], "origin": [-1.0, -24.6, 0.0], "size": [1.0, 25.0, 1.0] },
        { "uv": [0, 0], "origin": [-1.4, -24.6, 0.1], "size": [1.0, 25.0, 1.0] },
        { "uv": [0, 0], "origin": [-1.2, -25.5, 0.3], "size": [1.0, 1.0, 1.0] },
        { "uv": [0, 0], "origin": [-1.2, -25.5, 12.7], "size": [1.0, 1.0, 1.0] },
        { "uv": [0, 0], "origin": [11.2, -25.5, 0.3], "size": [1.0, 1.0, 1.0] },
        { "uv": [0, 0], "origin": [11.2, -25.5, 12.7], "size": [1.0, 1.0, 1.0] },
        { "uv": [0, 0], "origin": [-1.4, -24.6, 0.9], "size": [1.0, 25.0, 1.0] },
        { "uv": [0, 0], "origin": [-0.6, -24.6, 0.1], "size": [1.0, 25.0, 1.0] },
        { "uv": [0, 0], "origin": [-0.6, -24.6, 0.9], "size": [1.0, 25.0, 1.0] },
        { "uv": [0, 0], "origin": [-1.0, -24.6, 1.0], "size": [1.0, 25.0, 1.0] }
      ],
      "children": [
        { "name": "bone", "pivot": [-0.8, -12.5, 0.7], "rotation": [0.0, 45.000105, 0.0] },
        { "name": "bone2", "pivot": [-0.2, -12.5, 0.9], "rotation": [0.0, 45.000105, 0.0] }
      ]
    },
    {
      "name": "post2",
      "pivot": [6.5, 23.0, -7.0],
      "cubes": [
        { "uv": [0, 0], "origin": [-1.5, -24.6, 0.5], "size": [1.0, 25.0, 1.0] },
        { "uv": [0, 0], "origin": [-0.5, -24.6, 0.5], "size": [1.0, 25.0, 1.0] },
        { "uv": [0, 0], "origin": [-1.0, -24.6, 0.0], "size": [1.0, 25.0, 1.0] },
        { "uv": [0, 0], "origin": [-1.4, -24.6, 0.1], "size": [1.0, 25.0, 1.0] },
        { "uv": [0, 0], "origin": [-1.4, -24.6, 0.9], "size": [1.0, 25.0, 1.0] },
        { "uv": [0, 0], "origin": [-0.6, -24.6, 0.1], "size": [1.0, 25.0, 1.0] },
        { "uv": [0, 0], "origin": [-0.6, -24.6, 0.9], "size": [1.0, 25.0, 1.0] },
        { "uv": [0, 0], "origin": [-1.0, -24.6, 1.0], "size": [1.0, 25.0, 1.0] }
      ],
      "children": [
        { "name": "bone4", "pivot": [-0.8, -12.5, 0.7], "rotation": [0.0, 45.000105, 0.0] },
        { "name": "bone5", "pivot": [-0.2, -12.5, 0.9], "rotation": [0.0, 45.000105, 0.0] }
      ]
    },
    {
      "name": "post3",
      "pivot": [6.5, 23.0, 5.0],
      "cubes": [
        { "uv": [0, 0], "origin": [-1.5, -24.6, 0.5], "size": [1.0, 25.0, 1.0] },
        { "uv": [0, 0], "origin": [-0.5, -24.6, 0.5], "size": [1.0, 25.0, 1.0] },
        { "uv": [0, 0], "origin": [-1.0, -24.6, 0.0], "size": [1.0, 25.0, 1.0] },
        { "uv": [0, 0], "origin": [-1.4, -24.6, 0.1], "size": [1.0, 25.0, 1.0] },
        { "uv": [0, 0], "origin": [-1.4, -24.6, 0.9], "size": [1.0, 25.0, 1.0] },
        { "uv": [0, 0], "origin": [-0.6, -24.6, 0.1], "size": [1.0, 25.0, 1.0] },
        { "uv": [0, 0], "origin": [-0.6, -24.6, 0.9], "size": [1.0, 25.0, 1.0] },
        { "uv": [0, 0], "origin": [-1.0, -24.6, 1.0], "size": [1.0, 25.0, 1.0] }
      ],
      "children": [
        { "name": "bone6", "pivot": [-0.8, -12.5, 0.7], "rotation": [0.0, 45.000105, 0.0] },
        { "name": "bone7", "pivot": [-0.2, -12.5, 0.9], "rotation": [0.0, 45.000105, 0.0] }
      ]
    },
    {
      "name": "post4",
      "pivot": [-5.5, 23.0, 5.0],
      "cubes": [
        { "uv": [0, 0], "origin": [-1.5, -24.6, 0.5], "size": [1.0, 25.0, 1.0] },
        { "uv": [0, 0], "origin": [-0.5, -24.6, 0.5], "size": [1.0, 25.0, 1.0] },
        { "uv": [0, 0], "origin": [-1.0, -24.6, 0.0], "size": [1.0, 25.0, 1.0] },
        { "uv": [0, 0], "origin": [-1.4, -24.6, 0.1], "size": [1.0, 25.0, 1.0] },
        { "uv": [0, 0], "origin": [-1.4, -24.6, 0.9], "size": [1.0, 25.0, 1.0] },
        { "uv": [0, 0], "origin": [-0.6, -24.6, 0.1], "size": [1.0, 25.0, 1.0] },
        { "uv": [0, 0], "origin": [-0.6, -24.6, 0.9], "size": [1.0, 25.0, 1.0] },
        { "uv": [0, 0], "origin": [-1.0, -24.6, 1.0], "size": [1.0, 25.0, 1.0] }
      ],
      "children": [
        { "name": "bone8", "pivot": [-0.8, -12.5, 0.7], "rotation": [0.0, 45.000105, 0.0] },
        { "name": "bone15", "pivot": [-0.2, -12.5, 0.9], "rotation": [0.0, 45.000105, 0.0] }
      ]
    },
    {
      "name": "LeftDoor",
      "pivot": [4.5, 14.0, -5.5],
      "cubes": [
        { "uv": [0, 0], "origin": [-3.5, 3.9, -0.2], "size": [4.0, 4.0, 1.0] },
        { "uv": [4, 33], "origin": [-4.5, 7.9, -0.5], "size": [5.0, 1.0, 1.0] },
        { "uv": [6, 29], "origin": [-4.5, 3.9, -0.5], "size": [1.0, 4.0, 1.0] },
        { "uv": [7, 9], "origin": [-0.2, -12.1, -0.5], "size": [1.0, 21.0, 1.0] },
        { "uv": [6, 27], "origin": [-4.5, 2.9, -0.5], "size": [5.0, 1.0, 1.0] },
        { "uv": [0, 0], "origin": [-4.5, -1.1, -0.5], "size": [1.0, 4.0, 1.0] },
        { "uv": [0, 0], "origin": [-3.5, -1.1, -0.2], "size": [4.0, 4.0, 1.0] },
        { "uv": [0, 0], "origin": [-4.5, -2.1, -0.5], "size": [5.0, 1.0, 1.0] },
        { "uv": [0, 0], "origin": [-3.5, -6.1, -0.2], "size": [4.0, 4.0, 1.0] },
        { "uv": [82, 54], "origin": [-2.35, -4.6, -0.3], "size": [1.0, 1.0, 1.0] },
        { "uv": [0, 0], "origin": [-4.5, -6.1, -0.5], "size": [1.0, 4.0, 1.0] },
        { "uv": [0, 0], "origin": [-4.5, -7.1, -0.5], "size": [5.0, 1.0, 1.0] },
        { "uv": [0, 0], "origin": [-4.5, -11.1, -0.5], "size": [1.0, 4.0, 1.0] },
        { "uv": [0, 0], "origin": [-4.5, -12.1, -0.5], "size": [5.0, 1.0, 1.0] },
        { "uv": [42, 89], "origin": [-4.2, -11.125, -0.25], "size": [4.0, 4.0, 1.0] }
      ],
      "children": [
        {
          "name": "window3_1",
          "pivot": [-8.5, -7.1, -0.2],
          "rotation": [20.001957, 0.0, 0.0],
          "cubes": [
            { "uv": [38, 48], "origin": [4.7, -0.2621, -0.1818], "size": [4.0, 1.0, 1.0] }
          ]
        },
        {
          "name": "window2_1",
          "pivot": [-0.3, -8.6357, 0.2766],
          "rotation": [0.0, -45.000105, 0.0],
          "cubes": [
            { "uv": [38, 48], "origin": [-0.4293, -2.7, -0.5707], "size": [1.0, 4.0, 1.0] },
            { "uv": [38, 48], "origin": [-2.7627, -2.7, 1.7627], "size": [1.0, 4.0, 1.0] },
            { "uv": [38, 48], "origin": [-1.9849, -2.7, 0.9849], "size": [1.0, 4.0, 1.0] },
            { "uv": [38, 48], "origin": [-1.2071, -2.7, 0.2071], "size": [1.0, 4.0, 1.0] }
          ]
        },
        {
          "name": "Window1_1",
          "pivot": [-8.5, -7.4, -0.1],
          "rotation": [45.000105, 0.0, 0.0],
          "cubes": [
            { "uv": [38, 48], "origin": [4.7, -0.1943, -0.2648], "size": [4.0, 1.0, 1.0] },
            { "uv": [38, 48], "origin": [4.7, -2.846, 2.3868], "size": [4.0, 1.0, 1.0] },
            { "uv": [38, 48], "origin": [4.7, -1.5378, 1.0787], "size": [4.0, 1.0, 1.0] }
          ]
        }
      ]
    },
    {
      "name": "rightDoor",
      "pivot": [-4.5, 14.0, -5.5],
      "cubes": [
        { "uv": [0, 0], "origin": [-0.5, -7.1, -0.5], "size": [5.0, 1.0, 1.0] },
        { "uv": [83, 44], "origin": [-0.4, -6.0, -0.15], "size": [4.0, 4.0, 1.0] },
        { "uv": [0, 0], "origin": [3.5, -6.1, -0.5], "size": [1.0, 4.0, 1.0] },
        { "uv": [0, 0], "origin": [3.5, -11.1, -0.5], "size": [1.0, 4.0, 1.0] },
        { "uv": [0, 0], "origin": [-0.5, -12.1, -0.5], "size": [5.0, 1.0, 1.0] },
        { "uv": [42, 89], "origin": [-0.5, -11.125, -0.25], "size": [4.0, 4.0, 1.0] },
        { "uv": [0, 0], "origin": [-0.5, -1.1, -0.2], "size": [4.0, 4.0, 1.0] },
        { "uv": [0, 0], "origin": [-0.5, -2.1, -0.5], "size": [5.0, 1.0, 1.0] },
        { "uv": [0, 0], "origin": [3.5, -1.1, -0.5], "size": [1.0, 4.0, 1.0] },
        { "uv": [6, 29], "origin": [3.5, 3.9, -0.5], "size": [1.0, 4.0, 1.0] },
        { "uv": [6, 27], "origin": [-0.5, 2.9, -0.5], "size": [5.0, 1.0, 1.0] },
        { "uv": [4, 33], "origin": [-0.5, 7.9, -0.5], "size": [5.0, 1.0, 1.0] },
        { "uv": [0, 0], "origin": [-0.5, 3.9, -0.2], "size": [4.0, 4.0, 1.0] },
        { "uv": [6, 10], "origin": [-0.8, -12.1, -0.5], "size": [1.0, 21.0, 1.0] },
        { "uv": [66, 65], "origin": [0.15, -2.475, -0.35], "size": [3.0, 1.0, 1.0] },
        { "uv": [66, 64], "origin": [-0.45, -6.375, -0.35], "size": [1.0, 4.0, 1.0] },
        { "uv": [66, 65], "origin": [0.55, -6.775, -0.35], "size": [3.0, 1.0, 1.0] },
        { "uv": [66, 65], "origin": [3.15, -5.775, -0.35], "size": [1.0, 4.0, 1.0] }
      ],
      "children": [
        {
          "name": "bone3",
          "pivot": [4.75, -2.1, 0.2],
          "rotation": [0.0, -45.000105, 0.0],
          "cubes": [
            { "uv": [0, 0], "origin": [-0.75, -10.0, -0.5], "size": [1.0, 21.0, 1.0] }
          ]
        },
        {
          "name": "Window1_2",
          "pivot": [0.5, -7.4, -0.1],
          "rotation": [45.000105, 0.0, 0.0],
          "cubes": [
            { "uv": [38, 48], "origin": [-0.3, -0.1943, -0.2648], "size": [4.0, 1.0, 1.0] },
            { "uv": [68, 65], "origin": [-0.3, 3.518, -3.9771], "size": [4.0, 1.0, 1.0] },
            { "uv": [38, 48], "origin": [-0.3, -2.846, 2.3868], "size": [4.0, 1.0, 1.0] },